{
  "$schema": "http://json-schema.org/draft-07/schema#",
  "title": "Math Problem Schema",
  "description": "Schema for math problem definition files",
  "type": "object",
  "additionalProperties": false,
  "required": ["id", "title", "category", "difficulty", "geometry", "steps", "stepAnimations"],
  "properties": {
    "id": {
      "type": "string",
      "pattern": "^math-\\d{3}$"
    },
    "title": {
      "type": "string"
    },
    "source": {
      "type": "string"
    },
    "category": {
      "type": "string",
      "enum": ["几何", "代数", "函数", "统计", "概率"]
    },
    "difficulty": {
      "type": "string",
      "enum": ["easy", "medium", "hard"]
    },
    "tags": {
      "type": "array",
      "items": {
        "type": "string"
      }
    },
    "template": {
      "type": "object",
      "additionalProperties": false,
      "properties": {
        "type": {
          "type": "string"
        },
        "variant": {
          "type": "string"
        }
      }
    },
    "image": {
      "type": "string"
    },
    "geometry": {
      "type": "object",
      "additionalProperties": false,
      "required": ["points", "connections"],
      "properties": {
        "points": {
          "type": "array",
          "items": {
            "type": "object",
            "additionalProperties": false,
            "required": ["x", "y", "label"],
            "properties": {
              "x": {
                "type": "number"
              },
              "y": {
                "type": "number"
              },
              "label": {
                "type": "string"
              }
            }
          }
        },
        "connections": {
          "type": "array",
          "items": {
            "type": "array",
            "items": {
              "type": "string"
            },
            "minItems": 2,
            "maxItems": 2
          }
        },
        "edgeColors": {
          "type": "object",
          "additionalProperties": {
            "type": "string",
            "pattern": "^#[0-9A-Fa-f]{6}$"
          }
        },
        "rightAngles": {
          "type": "array",
          "items": {
            "type": "string"
          }
        },
        "angleArcs": {
          "type": "array",
          "items": {
            "type": "object",
            "additionalProperties": false,
            "required": ["id", "vertex", "from", "to", "path"],
            "properties": {
              "id": {
                "type": "string"
              },
              "vertex": {
                "type": "string"
              },
              "from": {
                "type": "string"
              },
              "to": {
                "type": "string"
              },
              "path": {
                "type": "string"
              },
              "isRightAngle": {
                "type": "boolean"
              },
              "type": {
                "type": "string",
                "enum": ["right", "acute", "obtuse"]
              }
            }
          }
        },
        "equalPairs": {
          "type": "object",
          "additionalProperties": {
            "type": "string"
          }
        },
        "triangles": {
          "type": "array",
          "items": {
            "type": "string",
            "pattern": "^[A-Z]{3}$"
          },
          "description": "三角形顶点组合，如 ABC, EDC"
        }
      }
    },
    "steps": {
      "type": "array",
      "items": {
        "type": "object",
        "additionalProperties": false,
        "required": ["id", "title", "content"],
        "properties": {
          "id": {
            "type": "integer",
            "minimum": 0
          },
          "title": {
            "type": "string"
          },
          "content": {
            "type": "string"
          },
          "conclusion": {
            "type": "string"
          }
        }
      }
    },
    "stepAnimations": {
      "type": "array",
      "items": {
        "type": "object",
        "additionalProperties": false,
        "properties": {
          "drawEdge": {
            "type": "array",
            "items": {
              "type": "string"
            }
          },
          "flashAngle": {
            "type": "array",
            "items": {
              "type": "string"
            }
          },
          "flyoutCompare": {
            "type": "array",
            "items": {
              "type": "object",
              "additionalProperties": false,
              "properties": {
                "edges": {
                  "type": "array",
                  "items": {
                    "type": "string"
                  }
                },
                "label": {
                  "type": "string"
                }
              }
            }
          },
          "highlightEdges": {
            "oneOf": [
              {
                "type": "array",
                "items": {
                  "type": "string"
                }
              },
              {
                "type": "array",
                "items": {
                  "type": "object",
                  "additionalProperties": false,
                  "properties": {
                    "edge": {
                      "type": "string"
                    },
                    "color": {
                      "type": "string"
                    }
                  }
                }
              }
            ]
          },
          "compareEdges": {
            "type": "object",
            "additionalProperties": false,
            "required": ["edge1", "edge2"],
            "properties": {
              "edge1": {
                "type": "string"
              },
              "edge2": {
                "type": "string"
              },
              "label": {
                "type": "string"
              }
            }
          },
          "compareAngles": {
            "type": "array",
            "items": {
              "type": "string"
            },
            "minItems": 2,
            "maxItems": 2
          },
          "showEqualMark": {
            "type": "array",
            "items": {
              "type": "string"
            }
          },
          "fillTriangle": {
            "type": "array",
            "items": {
              "type": "string"
            }
          },
          "showEqualMarks": {
            "type": "boolean"
          },
          "showLabels": {
            "type": "array",
            "items": {
              "type": "string"
            }
          },
          "highlights": {
            "type": "array",
            "items": {
              "type": "object",
              "additionalProperties": false,
              "properties": {
                "target": {
                  "type": "string"
                }
              }
            }
          },
          "flashTriangle": {
            "type": "array",
            "items": {
              "type": "string"
            }
          },
          "showRightAngles": {
            "type": "array",
            "items": {
              "type": "string"
            }
          },
          "proveCongruent": {
            "type": "object",
            "additionalProperties": false,
            "required": ["method", "triangle1", "triangle2", "pairs"],
            "properties": {
              "method": {
                "type": "string",
                "enum": ["SAS", "SSS", "ASA", "AAS", "HL"]
              },
              "triangle1": {
                "type": "string"
              },
              "triangle2": {
                "type": "string"
              },
              "pairs": {
                "type": "array",
                "items": {
                  "type": "object",
                  "additionalProperties": false,
                  "required": ["type", "items"],
                  "properties": {
                    "type": {
                      "type": "string",
                      "enum": ["edge", "angle"]
                    },
                    "items": {
                      "type": "array",
                      "items": {
                        "type": "string"
                      },
                      "minItems": 2,
                      "maxItems": 2
                    }
                  }
                }
              }
            }
          },
          "color": {
            "type": "string",
            "description": "Uniform highlight color for string-array highlightEdges"
          },
          "drawArcs": {
            "type": "array",
            "items": {
              "type": "string"
            },
            "description": "Arc IDs to draw (fallback when flashAngle is absent)"
          },
          "highlightArcs": {
            "type": "array",
            "items": {
              "type": "string"
            },
            "description": "Arc IDs to highlight (fallback when flashAngle is absent)"
          },
          "fillColors": {
            "type": "object",
            "additionalProperties": {
              "type": "string"
            },
            "description": "Per-triangle fill colors keyed by triangle ID"
          },
          "fillColor": {
            "type": "string",
            "description": "Uniform fill color for all triangles in fillTriangle"
          },
          "moveEdge": {
            "type": "string",
            "description": "Source edge label to move"
          },
          "targetEdge": {
            "type": "string",
            "description": "Target edge label to move to"
          },
          "moveTriangle": {
            "type": "string",
            "description": "Source triangle ID to move"
          },
          "targetTriangle": {
            "type": "string",
            "description": "Target triangle ID to move to"
          }
        }
      }
    },
    "question": {
      "type": "object",
      "additionalProperties": false,
      "properties": {
        "text": {
          "type": "string"
        },
        "diagram": {
          "type": "object",
          "additionalProperties": false,
          "properties": {
            "type": {
              "type": "string"
            },
            "points": {
              "type": "object",
              "additionalProperties": {
                "type": "object",
                "additionalProperties": false,
                "properties": {
                  "x": {
                    "type": "number"
                  },
                  "y": {
                    "type": "number"
                  }
                }
              }
            },
            "edges": {
              "type": "array",
              "items": {
                "type": "string"
              }
            },
            "rightAngles": {
              "type": "array",
              "items": {
                "type": "string"
              }
            },
            "equal": {
              "type": "array",
              "items": {
                "type": "string"
              }
            }
          }
        }
      }
    },
    "solution": {
      "type": "object",
      "additionalProperties": false,
      "properties": {
        "text": {
          "type": "string"
        }
      }
    },
    "created_at": {
      "type": "string",
      "format": "date-time"
    }
  }
}
